{
  "$id": "bureau_episode_manifest_v1.schema.json", "$schema": "https://json-schema.org/draft/2020-12/schema",
  "type": "object", "additionalProperties": false,
  "required": ["schema_version", "artifact_type", "artifact_id", "property_id", "episode_id", "created_at", "generator_version", "upstream_artifacts", "lifecycle_state", "generated_assets", "provider_jobs", "total_cost_cents", "total_attempts", "source_hashes", "edit_timeline", "narration_assets", "music_assets", "caption_assets", "clean_export_lineage", "platform_derivatives", "final_artifact_hashes"],
  "properties": {
    "schema_version": {"$ref": "common_defs_v1.schema.json#/$defs/schema_version"}, "artifact_type": {"const": "bureau_episode_manifest_v1"}, "artifact_id": {"$ref": "common_defs_v1.schema.json#/$defs/artifact_id"}, "property_id": {"$ref": "common_defs_v1.schema.json#/$defs/property_id"}, "episode_id": {"$ref": "common_defs_v1.schema.json#/$defs/episode_id"}, "created_at": {"$ref": "common_defs_v1.schema.json#/$defs/created_at"}, "generator_version": {"$ref": "common_defs_v1.schema.json#/$defs/generator_version"}, "upstream_artifacts": {"$ref": "common_defs_v1.schema.json#/$defs/upstream_artifacts"},
    "lifecycle_state": {"enum": ["pre_generation", "generated", "edited", "qa_approved", "published"]}, "generated_assets": {"type": "array", "items": {"$ref": "common_defs_v1.schema.json#/$defs/nonempty_string"}, "maxItems": 200}, "provider_jobs": {"type": "array", "items": {"$ref": "common_defs_v1.schema.json#/$defs/nonempty_string"}, "maxItems": 200}, "total_cost_cents": {"type": "integer", "minimum": 0}, "total_attempts": {"type": "integer", "minimum": 0}, "source_hashes": {"type": "array", "items": {"$ref": "common_defs_v1.schema.json#/$defs/upstream_artifact"}, "maxItems": 100}, "edit_timeline": {"type": "array", "items": {"$ref": "common_defs_v1.schema.json#/$defs/nonempty_string"}, "maxItems": 200}, "narration_assets": {"type": "array", "items": {"$ref": "common_defs_v1.schema.json#/$defs/nonempty_string"}, "maxItems": 50}, "music_assets": {"type": "array", "items": {"$ref": "common_defs_v1.schema.json#/$defs/nonempty_string"}, "maxItems": 50}, "caption_assets": {"type": "array", "items": {"$ref": "common_defs_v1.schema.json#/$defs/nonempty_string"}, "maxItems": 50}, "clean_export_lineage": {"type": "array", "items": {"$ref": "common_defs_v1.schema.json#/$defs/nonempty_string"}, "maxItems": 200}, "platform_derivatives": {"type": "array", "items": {"$ref": "common_defs_v1.schema.json#/$defs/nonempty_string"}, "maxItems": 100}, "final_artifact_hashes": {"type": "array", "items": {"$ref": "common_defs_v1.schema.json#/$defs/sha256"}, "maxItems": 100}
  }
}
